{
  "home": {
    "label": "Home – AI",
    "sections": {
      "hero": {
        "label": "Hero",
        "fields": {
          "kicker": {
            "label": "Hero Kicker",
            "path": "home.hero.kicker",
            "actions": ["rewrite", "shorten", "improve"]
          },
          "headline": {
            "label": "Hero Headline",
            "path": "home.hero.headline",
            "actions": ["rewrite", "shorten", "expand", "improve"]
          },
          "subheadline": {
            "label": "Hero Subheadline",
            "path": "home.hero.subheadline",
            "actions": ["rewrite", "shorten", "expand"]
          },
          "primary_cta": {
            "label": "Primary CTA",
            "path": "home.hero.primary_cta",
            "actions": ["rewrite", "shorten"]
          },
          "secondary_cta": {
            "label": "Secondary CTA",
            "path": "home.hero.secondary_cta",
            "actions": ["rewrite", "shorten"]
          },
          "stats.value": {
            "label": "Stats Value",
            "path": "home.hero.stats.value",
            "actions": ["rewrite", "shorten"]
          },
          "stats.label": {
            "label": "Stats Label",
            "path": "home.hero.stats.label",
            "actions": ["rewrite", "shorten", "improve"]
          },
          "cards.title": {
            "label": "Hero Cards – Title",
            "path": "home.hero.cards[].title",
            "actions": ["rewrite", "shorten"]
          },
          "cards.text": {
            "label": "Hero Cards – Text",
            "path": "home.hero.cards[].text",
            "actions": ["rewrite", "shorten", "improve"]
          }
        }
      }
    }
  },

  "about": {
    "label": "About – AI",
    "fields": {
      "kicker": {
        "label": "About Kicker",
        "path": "about.kicker",
        "actions": ["rewrite", "shorten"]
      },
      "headline": {
        "label": "About Headline",
        "path": "about.headline",
        "actions": ["rewrite", "shorten", "expand"]
      },
      "description": {
        "label": "About Description",
        "path": "about.description",
        "actions": ["rewrite", "shorten", "expand", "improve"]
      },
      "media.title": {
        "label": "Media Title",
        "path": "about.media.title",
        "actions": ["rewrite", "shorten"]
      },
      "media.subtitle": {
        "label": "Media Subtitle",
        "path": "about.media.subtitle",
        "actions": ["rewrite", "shorten"]
      },
      "points": {
        "label": "Key Points",
        "path": "about.points[]",
        "actions": ["rewrite", "shorten", "improve"]
      },
      "author.name": {
        "label": "Author Name",
        "path": "about.author.name",
        "actions": ["rewrite"]
      },
      "author.role": {
        "label": "Author Role",
        "path": "about.author.role",
        "actions": ["rewrite"]
      },
      "cta": {
        "label": "About CTA",
        "path": "about.cta",
        "actions": ["rewrite", "shorten"]
      }
    }
  },

  "departments": {
    "label": "Departments – AI",
    "fields": {
      "kicker": {
        "label": "Departments Kicker",
        "path": "departments.kicker",
        "actions": ["rewrite", "shorten"]
      },
      "headline": {
        "label": "Departments Headline",
        "path": "departments.headline",
        "actions": ["rewrite", "shorten", "expand"]
      },
      "description": {
        "label": "Departments Description",
        "path": "departments.description",
        "actions": ["rewrite", "shorten", "improve"]
      },
      "cta": {
        "label": "Departments CTA",
        "path": "departments.cta",
        "actions": ["rewrite", "shorten"]
      },
      "items.title": {
        "label": "Department Titles",
        "path": "departments.items[].title",
        "actions": ["rewrite", "shorten"]
      }
    }
  },

  "services": {
    "label": "Services – AI",
    "fields": {
      "kicker": {
        "label": "Services Kicker",
        "path": "services.kicker",
        "actions": ["rewrite", "shorten"]
      },
      "headline": {
        "label": "Services Headline",
        "path": "services.headline",
        "actions": ["rewrite", "shorten", "expand"]
      },
      "items.title": {
        "label": "Service Title",
        "path": "services.items[].title",
        "actions": ["rewrite", "shorten"]
      },
      "items.description": {
        "label": "Service Description",
        "path": "services.items[].description",
        "actions": ["rewrite", "shorten", "improve"]
      }
    }
  },

  "testimonials": {
    "label": "Testimonials – AI",
    "fields": {
      "headline": {
        "label": "Testimonials Headline",
        "path": "testimonials.headline",
        "actions": ["rewrite", "shorten"]
      },
      "subheadline": {
        "label": "Testimonials Subheadline",
        "path": "testimonials.subheadline",
        "actions": ["rewrite", "shorten"]
      },
      "items.text": {
        "label": "Testimonial Text",
        "path": "testimonials.items[].text",
        "actions": ["rewrite", "shorten", "improve"]
      }
    }
  },

  "appointment": {
    "label": "Appointment – AI",
    "fields": {
      "pill": {
        "label": "Appointment Pill",
        "path": "appointment.pill",
        "actions": ["rewrite", "shorten"]
      },
      "title": {
        "label": "Appointment Title",
        "path": "appointment.title",
        "actions": ["rewrite", "shorten", "expand"]
      },
      "subtitle": {
        "label": "Appointment Subtitle",
        "path": "appointment.subtitle",
        "actions": ["rewrite", "shorten", "improve"]
      },
      "call_label": {
        "label": "Call Label",
        "path": "appointment.call_label",
        "actions": ["rewrite", "shorten"]
      }
    }
  },

  "footer": {
    "label": "Footer – AI",
    "fields": {
      "brand.logo": {
        "label": "Brand Logo Text",
        "path": "footer.brand.logo",
        "actions": ["rewrite"]
      },
      "brand.description": {
        "label": "Brand Description",
        "path": "footer.brand.description",
        "actions": ["rewrite", "shorten", "improve"]
      },
      "copyright": {
        "label": "Copyright",
        "path": "footer.copyright",
        "actions": ["rewrite"]
      }
    }
  }
}
